Judul,Tanggal,Penulis,Label,Kota,Content,Url
"Terlibat Kecelakaan di Sukoharjo, Mobil Pajero dan Honda Beat Terbakar","Kompas.com - 08/06/2022, 10:36 WIB","Kontributor Solo, Labib Zamani",Regional,"SUKOHARJO, KOMPAS.com","
SUKOHARJO, KOMPAS.com - Sebuah mobil Mitsubishi Pajero AD 1492 FA terlibat kecelakaan dengan Honda Beat AD 3915 OS di Jalan Ir Soekarno, tepatnya di simpang empat Bundaran SS Soba, Desa Langenharjo, Kecamatan Grogol, Kabupatan Sukoharjo, Jawa Tengah, Selasa (7/6/2022), pukul 18.15 WIB.
Akibat kejadian tersebut, baik mobil Pajero maupun sepeda motor terbakar.
Kapolres Sukoharjo AKBP Wahyu Nugroho Setyawan mengatakan kecelakaan terjadi bermula saat mobil Pajero AD 1492 FA yang dikemudikan Christopher Ian Hartono (17) berjalan dari arah Timur ke Barat.
Sedangkan sepeda motor Honda Beat AD 3915 OS yang dikemudikan Kus Indrastuti (67) berjalan searah di depannya, di lajur sebelah kiri.
Baca juga: Dalam Sehari, 2 Siswa di Malang Tewas akibat Kecelakaan Lalu Lintas
Sampai di lokasi kejadian pengendara sepeda motor berpindah lajur ke kanan tanpa memperhatikan situasi arus lalu lintas dari arah belakang sehingga tertabrak mobil Pajero.
""Pengendara sepeda motor terpental ke kiri, terseret dan terbakar,"" kata Wahyu dikonfirmasi Kompas.com, Rabu (8/6/2022).
Selain terbakar, kecelakaan lalu lintas tersebut sembuat pengendara sepeda motor mengalami luka dan dirujuk ke rumah sakit. Kecelakaan tersebut juga mengakibatkan kerugian materiil sebesar Rp 15 juta.
""Korban luka ringan. Mata kanan bengkak, kaki kanan dan kiri lecet. Korban dirawat di RS Indriati Solobaru,"" terang dia.
Sementara untuk kedua kendaraan yang terlibat kecelakaan sudah diamankan di Polres Sukoharjo sebagai barang bukti.
Dapatkan update berita pilihan dan breaking news setiap hari dari Kompas.com. Mari bergabung di Grup Telegram ""Kompas.com News Update"", caranya klik link https://t.me/kompascomupdate, kemudian join. Anda harus install aplikasi Telegram terlebih dulu di ponsel.
 ",http://regional.kompas.com/read/2022/06/08/103619778/terlibat-kecelakaan-di-sukoharjo-mobil-pajero-dan-honda-beat-terbakar
"Viral, Video Detik-detik Truk Bermuatan yang Hilang Keseimbangan Hantam Mobil di Nagreg, Ini Kronologinya","Kompas.com - 07/06/2022, 12:51 WIB",Dandy Bayu Bramasta,Tren,KOMPAS.com,"

KOMPAS.com - Sebuah video yang memperlihatkan detik-detik truk bermuatan hilang keseimbangan menghantam mobil di Jalan Cagak, Nagreg, Kabupaten Bandung, Jawa Barat viral di media sosial.
Video itu salah satunya diunggah oleh akun ini di grup Facebook Romansa Sopir Truck (RST), Senin (6/6/2022).
""Lakalantas di Cagak, Nagreg, Garut. Senin, 06/06/22, sekitar pukul 10.22 WIB. Terlihat dalam rekaman CCTV sebuah truk bermuatan berat terguling dan menipa sebuah mobil. Belum diketahui kronologi dan korban dari laka tersebut,"" tulis pengunggah.
Baca juga: Mengurai Persoalan Kecelakaan Bus Pariwisata yang Belakangan Kerap Terjadi
Hingga Selasa (7/6/2022), unggahan video tersebut telah disukai 518 kali, dikomentari 185 kali, dan dibagikan 506 kali oleh pengguna Facebook.
Dalam video, tampak sebuah mobil salah arah di Jalur Cagak, Nagreg. Kemudian, petugas kepolisian membantu mengarahkan.
Namun tak berlangsung lama, truk bermuatan tersebut langsung menghantam mobil yang terlihat sedang mundur itu.
Seorang anggota kepolisian nyaris menjadi korban.
Baca juga: Viral, Unggahan Ambil Foto di Bromo Dikenakan Biaya Rp 1 Juta, KLHK Beri Penjelasan

Baca juga: Video Viral Pengendara Motor Tertabrak Kereta Setelah Terobos Palang Pelintasan
Lantas, bagaimana kronologi kejadian dari kecelakaan lalu lintas tersebut?
Tidak ada korban jiwa
Kepala Unit Kecelakaan Lalu Lintas Kepolisian Resor Kota (Kanit Laka Lantas Polresta) Bandung Ajun Komisaris Polisi (AKP) Zazid Abdullah membenarkan kecelakaan itu terjadi di Cagak, Nagreg.
""Kejadian kemarin Senin, 6 Juni 2022 jam 10.25 WIB kurang lebih. Itu kebetulan penanganan oleh Unit Lantas Polsek Nagreg,"" ujarnya, saat dihubungi Kompas.com, melalui sambungan telepon, Selasa (7/6/2022). 
",http://www.kompas.com/tren/read/2022/06/07/125100965/viral-video-detik-detik-truk-bermuatan-yang-hilang-keseimbangan-hantam
"Dalam Sehari, 2 Siswa di Malang Tewas akibat Kecelakaan Lalu Lintas","Kompas.com - 06/06/2022, 23:57 WIB","Kontributor Kabupaten Malang, Imron Hakiki",Regional,MALANG,"

MALANG, KOMPAS.com - Dalam sehari, dua pelajar di Kabupaten Malang, Jawa Timur, tewas akibat kecelakaan lalu lintas, Senin (6/5/2022). Kecelakaan terjadi di dua lokasi yang berbeda.
Kecelakaan pertama terjadi Jalan Raya Wahidin, Kecamatan Lawang. Elizabeth Novira (15), siswa kelas 10 IPS 4 SMAN 1 Lawang tewas akibat terserempet sepeda motor saat hendak berangkat ke sekolah sekitar pukul 06.00 WIB.
""Kala itu korban hendak menyeberang jalan. Tanpa disadari dari arah Pasuruan terdapat sepeda motor Honda Vario bernomor polisi N 5417 ABM yang dikendarai Brilly Rahmatullah melaju dengan kecepatan sedang untuk menyalip mobil truk,"" ungkap Kanit Gakum Satuan Lalu Lintas Kepolisian Resor Malang Iptu Sunarko melalui sambungan telepon, Senin.
Baca juga: Pengawasan Diperketat, Setiap Hewan Ternak yang Masuk Kota Malang Diperiksa
Karena jarak sudah dekat, sepeda motor Vario tersebut akhirnya menabrak korban dari samping hingga tersungkur ke timur.
""Di saat yang sama, ternyata ada truk yang dikemudikan orang tidak dikenal juga melaju dari arah Pasuruan. Karena tidak memungkinkan untuk mengendalikan remnya, korban akhirnya tertabrak di bagian kepala,"" tutunya.
Baca juga: Terbukti Korupsi Dana Desa Rp 423 Juta, Kades Kalipare Malang Ditahan Polisi
Korban pun meninggal seketika di lokasi kejadian. Sementara itu, pengendar truk itu justru meninggalkan lokasi kejadian saat itu juga.
""Saat ini kami masih mengejar pengemudi truk terduga yang telah menabrak korban,"" jelas Sunarko.
Kecelakaan serupa terjadi di Jalan Raya Malang-Gempol, Kecamatan Singosari. Ahmad Nur Maulana (16), pelajar kelas 11 di MA Al Maarif Singosari tewas saat motor Vario N 4063 TCW yang dikendarainya dari arah Malang menuju Pasuruan menyerempet truk yang melaju searah sekitar pukul 14.15 WIB. 
""Kala itu ia hendak mendahului truk tersebut. Namun karena jarak terlalu dekat ia tersenggol badan truk hingga terjatuh,"" jelas Sunarko.
Sunarko menduga, korban yang beralamat di Desa Parerejo, Kecamatan Purwodadi, Kabupaten Pasuruan, itu hendak pulang dari sekolahnya.
""Peristiwa ini masih kami lakukan pendalaman. Kami masih menggelar olah tempat kejadian perkara (TKP), mengumpulkan bukti-bukti dari saksi dan rekaman CCTV untuk mencari tahu pengemudi truk tersebut,"" tuturnya.
Dapatkan update berita pilihan dan breaking news setiap hari dari Kompas.com. Mari bergabung di Grup Telegram ""Kompas.com News Update"", caranya klik link https://t.me/kompascomupdate, kemudian join. Anda harus install aplikasi Telegram terlebih dulu di ponsel.
 ",http://surabaya.kompas.com/read/2022/06/06/235736378/dalam-sehari-2-siswa-di-malang-tewas-akibat-kecelakaan-lalu-lintas
Begini Isi Perpres Keselamatan Lalin dan Angkutan Jalan yang Ditetapkan Jokowi,"Kompas.com - 06/06/2022, 16:58 WIB",Suhaiela Bahfein,Berita,"JAKARTA, KOMPAS.com","
JAKARTA, KOMPAS.com - Presiden Joko Widodo (Jokowi) telah menetapkan Peraturan Presiden (Perpres) Nomor 1 Tahun 2022 tentang Rencana Umum Nasional Keselamatan Lalu Lintas dan Angkutan Jalan (RUNK LLAJ), 3 Januari 2022.
Beleid tersebut ditetapkan untuk melaksanakan ketentuan Pasal 6 ayat 1 Peraturan Pemerintah (PP) Nomor 37 Tahun 2017 tentang Keselamatan Lalu Lintas dan Angkutan Jalan (KLLAJ).
Dengan demikian, perlu ditetapkan Peraturan Presiden (Perpres) tentang RUNK LLAJ.
Baca juga: Susun Rencana Keselamatan Lalin, Pemprov Harus Koordinasi dengan Kemendagri
Dalam Pasal 2 Perpres tersebut, RUNK LLAJ ditetapkan untuk periode 20 tahun untuk jangka waktu tahun 2021 sampai dengan 2040.
RUNK LLAJ sebagaimana dimaksud menjadi acuan bagi Kementerian/Lembaga (K/L) Pemerintah Provinsi (Pemprov), dan Pemerintah Kabupaten/Kota (Pemkab/Pemkot).
Kemudian, menyinergikan penyusunan dokumen perencanaan, pelaksanaan, dan pengendalian Keselamatan LLAJ (KLLAJ).
Penyusunan RUNK LLAJ memperhatikan beberapa hal yakni, rencana pembangunan jangka panjang dan menengah nasional, perkembangan lingkungan strategis KLLAJ dalam 10 tahun terakhir, dan tujuan pembangunan berkelanjutan Sustainable Development Goals (SDG's).
Program nasional KLLAJ sebagaimana dimaksud terdiri atas lima pilar yang meliputi sistem, jalan, kendaraan, pengguna jalan berkeselamatan, serta penanganan korban kecelakaan.
Perpres ini diterbitkan karena dilatarbelakangi dengan peningkatan pergerakan manusia dan barang.
Baca juga: Perusahaan hingga Masyarakat Bisa Berpartisipasi Susun Rencana Aksi Keselamatan Lalin
Hal ini berdampak pada meningkatnya potensi terjadinya kecelakaan transportasi, terutama LLAJ. 
",http://www.kompas.com/properti/read/2022/06/06/165808921/begini-isi-perpres-keselamatan-lalin-dan-angkutan-jalan-yang-ditetapkan
Perusahaan hingga Masyarakat Bisa Berpartisipasi Susun Rencana Aksi Keselamatan Lalin,"Kompas.com - 06/06/2022, 16:00 WIB",Suhaiela Bahfein,Berita,"JAKARTA, KOMPAS.com","
JAKARTA, KOMPAS.com - Perusahaan hingga masyarakat bisa turut berpartisipasi dalam penyusunan dan pelaksanaan Rencana Aksi Keselamatan Lalu Lintas dan Angkutan Jalan (RAK LLAJ), baik di tingkat Kementerian/Lembaga (K/L) serta Kabupaten/Kota.
Ini tercantum dalam Pasal 5 ayat 7 Peraturan Presiden (Perpres) Nomor 1 Tahun 2022 tentang Rencana Umum Nasional Keselamatan Lalu Lintas dan Angkutan Jalan (RUNK LLAJ).
Asal tahu saja, Perpres ini telah ditetapkan dan diberlakukan di Jakarta, 3 Januari 2022.
""Badan Usaha dan Masyarakat dapat berpartisipasi dalam penyusunan dan pelaksanaan RAK LLAJ Kementerian/Lembaga dan RAK LLAJ Provinsi/ Kabupaten/ Kota"".
Dalam pasal 5 ayat 1 peraturan tersebut, RAK LLAJ disusun dalam rangka melaksanakan RUNK LLAJ.
RAK LLAJ sebagaimana dimaksud pada ayat 1 disusun dan dilaksanakan oleh Kementerian/Lembaga (K/L) sesuai dengan kewenangannya, Pemprov, serta Pemerintah Kabupaten/Kota (Pemkab/Pemkot).
Perpres ini diterbitkan karena dilatarbelakangi dengan peningkatan pergerakan manusia dan barang.
Hal ini berdampak pada meningkatnya potensi terjadinya kecelakaan transportasi, terutama LLAJ.
Baca juga: Kurangi Fatalitas Kecelakaan di Jalan Tol, Crash Cushion Wajib Anda Ketahui
Berdasarkan data Kepolisian Negara Republik Indonesia, jumlah kematian akibat kecelakaan LLAJ yang terjadi pada tahun 2020 telah mencapai 23.529 jiwa atau setara dengan tiga jiwa meninggal dunia per jam.
Permasalahan Keselamatan LLAJ (KLLAJ) tidak hanya dihadapi dalam skala nasional, tetapi juga menjadi masalah global. 
",http://www.kompas.com/properti/read/2022/06/06/160000621/perusahaan-hingga-masyarakat-bisa-berpartisipasi-susun-rencana-aksi
"Susun Rencana Keselamatan Lalin, Pemprov Harus Koordinasi dengan Kemendagri","Kompas.com - 06/06/2022, 15:40 WIB",Suhaiela Bahfein,Berita,"JAKARTA, KOMPAS.com","
JAKARTA, KOMPAS.com - Pemerintah Provinsi (Pemprov) wajib berkoordinasi dengan Kementerian Dalam Negeri (Kemendagri) dalam penyusunan Rencana Aksi Keselamatan Lalu Lintas Angkutan Jalan (RAK LLAJ).
Ketentuan ini sebagaimana tertuang dalam Pasal 5 ayat 5 Peraturan Presiden (Perpres) Nomor 1 Tahun 2022 tentang Rencana Umum Nasional Keselamatan Lalu Lintas dan Angkutan Jalan (RUNK LLAJ).
Dalam pasal itu berbunyi, ""Pemerintah Daerah Provinsi sebagaimana dimaksud pada ayat (2) huruf b berkoordinasi dan berkonsultasi dengan Penanggung Jawab Pilar dan Kementerianyang menyelenggarakan urusan pemerintahan di bidang dalam negeri dalam menyusun RAK LLAJ Provinsi"".
Pada aturan itu diketahui bahwa Perpres Nomor 1 Tahun hnb2022 tentang RUNK LLAJ telah ditetapkan dan diberlakukan di Jakarta, 3 Januari 2022.
Dalam pasal 5 ayat 1 peraturan tersebut, RAK LLAJ disusun dalam rangka melaksanakan RUNK LLAJ.
RAK LLAJ sebagaimana dimaksud pada ayat 1 disusun dan dilaksanakan oleh Kementerian/Lembaga (K/L) sesuai dengan kewenangannya, Pemprov, serta Pemerintah Kabupaten/Kota (Pemkab/Pemkot).
Perpres ini diterbitkan karena dilatarbelakangi dengan peningkatan pergerakan manusia dan barang.
Hal ini berdampak pada meningkatnya potensi terjadinya kecelakaan transportasi, terutama LLAJ.
Baca juga: Ini Faktor-faktor Penyebab Kecelakaan Lalu Lintas
Berdasarkan data Kepolisian Negara Republik Indonesia, jumlah kematian akibat kecelakaan LLAJ yang terjadi pada tahun 2020 telah mencapai angka 23.529 jiwa atau setara dengan tiga jiwa meninggal dunia per jam.
Permasalahan Keselamatan LLAJ (KLLAJ) tidak hanya dihadapi dalam skala nasional, tetapi juga menjadi masalah global. 
",http://www.kompas.com/properti/read/2022/06/06/154056221/susun-rencana-keselamatan-lalin-pemprov-harus-koordinasi-dengan
"Kecelakaan Truk dan 3 Sepeda Motor di Lombok Tengah, Bocah Usia 5 Tahun Tewas","Kompas.com - 05/06/2022, 18:49 WIB","Kontributor Lombok Tengah, Idham Khalid",Regional,"LOMBOK TENGAH, KOMPAS.com","
LOMBOK TENGAH, KOMPAS.com- Kecelakaan lalu lintas antara truk dan tiga sepeda motor terjadi di Desa Kawo, Lombok Tengah, Nusa Tenggara Barat (NTB) pada Minggu (5/6/2022).
Diketahui identitas pengemudi truk tersebut berjenis kelamin laki-laki dengan inisial MN (25), warga Desa Perai Meke, Kecamatan Praya Tengah, Kabupaten Lombok Tengah.
Adapun identitas pengendara sepeda motor jenis Supra Fit berinisial S (40) alamat Dusun Barelantan, Desa Gapura, Lombok Tengah.
Kemudian pengendara sepeda motor Honda Vario 150 berinisial RT (30), warga Desa Kawo, Lombok Tengah. RT diketahui berboncengan dengan anaknya AP (5) yang meninggal dunia akibat insiden tersebut.
Sedangkan pemotor ketiga yakni HA (50) warga Desa Kawo, mengendarai motor Honda Beat.
Baca juga: Kecelakaan Maut Truk Tangki Pertamina di Pantura Indramayu, 2 Tewas, Polisi: Diduga Gagal Menyalip
Kapolsek Pujut IPTU Derpin Hutabarat mengungkapkan, kejadiannya bermula saat truk yang dikendarai oleh MN datang dari arah Utara menuju Selatan.
Sesampainya di tempat kejadian perkara (TKP) tiba-tiba keluar dari gerbang sebuah rumah sepeda motor Supra Fit yang dikendarai oleh S. Dia mengatakan S hendak menyeberang tanpa menoleh ke kiri maupun ke kanan.
MN yang kaget spontan membanting setir sehingga posisi kendaraan menutupi jalan.
""Bersamaan dengan itu, dua pengendara melaju dari arah selatan menuju Utara dan langsung menabrak dump truk tersebut. Sehingga salah satu korban inisial AP yang dibonceng oleh Ibunya inisial RT meninggal dunia di tempat kejadian, "" kata Derpin melalui keterangan tertulis.
Petugas kepolisian dari Polsek Pujut langsung menuju lokasi kejadian untuk melakukan pengamanan olah TKP dan mengevakusi barang bukti.
Selain itu pihaknya melakukan evakuasi korban dengan dibantu masyarakat sekitar. Korban dibawa ke Puskesmas Sengkol untuk dilakukan penanganan medis.
""Sementara untuk dua orang korban inisial RT dan S dirujuk menuju RSUD Praya. Barang bukti telah diamankan di unit Lakalantas Polres Lombok Tengah untuk dilakukan penanganan lebih lanjut,"" kata Derpin.
Dapatkan update berita pilihan dan breaking news setiap hari dari Kompas.com. Mari bergabung di Grup Telegram ""Kompas.com News Update"", caranya klik link https://t.me/kompascomupdate, kemudian join. Anda harus install aplikasi Telegram terlebih dulu di ponsel.
 ",http://regional.kompas.com/read/2022/06/05/184930378/kecelakaan-truk-dan-3-sepeda-motor-di-lombok-tengah-bocah-usia-5-tahun
"2 Motor ""Adu Banteng"" di Pematangsiantar, 2 Korban Tewas, Salah Satunya Pelajar","Kompas.com - 05/06/2022, 17:50 WIB","Kontributor Pematangsiantar, Teguh Pribadi",Regional,"PEMATANGSIANTAR, KOMPAS.com","
PEMATANGSIANTAR, KOMPAS.com - Dua pemotor tewas setelah alami kecelakaan lalu lintas di persimpangan Jalan Sangnaualuh-Jalan Kertas, Kecamatan Siantar Timur, Pematangsiantar, Sumatera Utara (Sumut), Sabtu (4/6/2022) malam. Kedua korban tersebut mengalami luka berat hingga meninggal dunia di lokasi kejadian.
Kasubag Humas Polres Pematangsiantar Iptu Rusdi Ahya mengatakan, kedua korban masing-masing mengendarai sepeda motor datang dari arah yang berbeda.
Sebelum kejadian, sepeda motor matik BK 3372 WAE yang dikendarai korban inisial AG (37) datang dari Jalan Kertas berbelok ke kanan menuju Simpang Sambo melalui Jalan Sangnawaluh.
Baca juga: Kronologi TKA Asal China Tikam Rekan Kerja hingga Tewas, Berawal Pelaku Tanya Kontrak Kerja Habis ke Orangtua Korban
Sementara sepeda motor jenis Kawasaki tanpa plat yang dikendarai MUH (16) datang dari arah simpang Sambo melalui Jalan Sangnawaluh menuju komplek Megaland.
""Kejadiannya malam pukul 22.15 WIB dan dilaporkan pukul 22.30 WIB. Korban dua orang meninggal dunia. Penyebab kecelakaan masih dalam penyelidikan,"" kata Rusdi dalam keterangan tertulis Humas Polres Pematangsiantar, Minggu (5/6/2022).
Baca juga: Kecelakaan Maut Truk Tangki Pertamina di Pantura Indramayu, 2 Tewas, Polisi: Diduga Gagal Menyalip
Dari lokasi kejadian, polisi kemudian membawa kedua korban ke ruang instalasi jenazah RSUD Djasamen Saragih Pematangsiantar. Sementara dua sepeda motor diamankan di Polres Pematangsiantar.
Rusdi mengatakan, salah satu korban inisial MUH (16) berstatus pelajar asal Kabupaten Simalungun. Sementara AG (37) merupakan karyawan swasta beralamat di Jalan Marimbun Kota Pematangsiantar.
Dapatkan update berita pilihan dan breaking news setiap hari dari Kompas.com. Mari bergabung di Grup Telegram ""Kompas.com News Update"", caranya klik link https://t.me/kompascomupdate, kemudian join. Anda harus install aplikasi Telegram terlebih dulu di ponsel.
 ",http://medan.kompas.com/read/2022/06/05/175050578/2-motor-adu-banteng-di-pematangsiantar-2-korban-tewas-salah-satunya-pelajar
"Video Viral Kecelakaan Diduga akibat Ban Pecah di Jaksel, Ini Kronologinya","Kompas.com - 05/06/2022, 13:35 WIB",Taufieq Renaldi Arfiansyah,Tren,KOMPAS.com,"

KOMPAS.com - Unggahan video kecelakaan antara mobil dan motor di Jalan Jenderal Sudirman, Jakarta Selatan, viral di media sosial.
Dalam postingan video yang beredar memperlihatkan kondisi kendaraan yang mengalami kerusakan paska kecelakaan tersebut.
Selain itu, mobil yang juga menabrak pembatas jalan, membuat material pembatas berhamburan di jalan.
Akibatnya lalu lintas pun menjadi padat dan tersendat, karena pihak kepolisan dan masyarakat mengevakuasi kendaraan yang mengalami kecelakaan.
Video tersebut salah satunya dibagikan oleh akun ini, pada Minggu (5/6/2022).
Menurut akun tersebut kecelakaan itu terjadi di Jalan Jenderal Sudirman, Senayan, Kebayoran Baru, Jakarta Selatan pada Minggu (5/6/2022) sekitar pukul 02.30 WIB.
""DIDUGA HILANG KENDALI AKIBAT PECAH BAN, TOYOTA INNOVA TABRAK DUA MOTOR DI SUDIRMAN,"" tulis akun tersebut.
Pengendara motor yang terluka karena tertabrak mobil kemudian dilarikan ke rumah sakit Siloam, Jakarta.


 
 
 

Lihat postingan ini di Instagram

 
 
 
Sebuah kiriman dibagikan oleh Merekam Jakarta Lewat Kamera (@merekamjakarta)


Hingga Minggu (6/6/2022) pukul 10.25 WIB, video tersebut sudah dilihat oleh 14.783 warganet.
Baca juga: Video Viral Uang Salah Potong Dijual hingga 50 Kali Lipat, Ini Penjelasan BI
Keterangan polisi
Kasubdit Gakkum Polda Metro Jaya AKBP Jamal Alam mengatakan bahwa kecelakaan tersebut terjadi pada Minggu (5/6/2022) pukul 20.40 WIB. 
",http://www.kompas.com/tren/read/2022/06/05/133500465/video-viral-kecelakaan-diduga-akibat-ban-pecah-di-jaksel-ini-kronologinya
"Salip Motor di Tikungan, Pengendara Jupiter di Nunukan Tewas Tertabrak Truk ","Kompas.com - 05/06/2022, 10:40 WIB","Kontributor Nunukan, Ahmad Dzulviqor",Regional,"NUNUKAN, KOMPAS.com","
NUNUKAN, KOMPAS.com – Kecelakaan lalu lintas (Laka Lantas) antara motor Jupiter Z dan truk terjadi di Jalan Poros Provinsi Kaltara, di Desa Apas, Kecamatan Sebuku, Kabupaten Nunukan, Kalimantan Utara, Sabtu (4/6/2022).
Kecelakaan adu banteng tersebut menewaskan pengendara motor Jupiter Z bernama Muhammad Ishak (34), seorang pekerja swasta beralamat di Jalan RA Kartini Baru, Desa Nepo, Kecamatan Tanasitolo, Kabupaten Wajo, Sulawesi Selatan.
Baca juga: Pemotor Tewas Usai Lawan Arus dan Tertabrak Truk di Bekasi
Kasat Lantas Polres Nunukan, AKP Arofiek Aprilian Riswanto mengungkapkan, pengemudi motor tewas di tempat pada insiden tersebut.
""Pengemudi motornya tewas di tempat, dia terluka robek parah di bagian lengan kanan, kaki dan kepala,"" ujarnya, Minggu (5/6/2022).
Kondisi motor juga ringsek, kap kanan dan kiri pecah, begitu juga wadah lampu bagian depan.
Sementara mobil truk Mitsubishi kuning bernomor Polisi KU 8570 N, hanya mengalami penyok di kap bagian depan.
Arofiek menuturkan, kecelakaan bermula ketika pengendara motor Jupiter Z memacu kendaraannya dengan kencang dan menyalip sepeda motor di depannya.
Jalanan sepi dengan aspal mulus, membuat laju kendaraan semakin kencang tanpa hambatan.
""Tapi itu kondisinya jalanan menikung. Saat menyalip, muncul mobil truk dari arah berlawanan, dan terjadilah peristiwa tersebut,"" jelasnya.
Polisi mengamankan semua kendaraan yang terlibat, termasuk juga supir truk bernama AG (22), yang merupakan warga Jalan Aki Tinudin RT 02 Desa Apas Kecamatan Sebuku.
""Kita masih lakukan penyelidikan,"" kata Arofiek.
Baca juga: Pejalan Kaki yang Sedang Cari Rongsokan Tewas Tertabrak Truk Boks
Dapatkan update berita pilihan dan breaking news setiap hari dari Kompas.com. Mari bergabung di Grup Telegram ""Kompas.com News Update"", caranya klik link https://t.me/kompascomupdate, kemudian join. Anda harus install aplikasi Telegram terlebih dulu di ponsel.
 ",http://regional.kompas.com/read/2022/06/05/104020478/salip-motor-di-tikungan-pengendara-jupiter-di-nunukan-tewas-tertabrak-truk
"Viral Pemukulan di Tol Dalam Kota, Ini Pentingnya Defensive Driving","Kompas.com - 05/06/2022, 08:21 WIB",Dio Dananjaya,News,"JAKARTA, KOMPAS.com","

JAKARTA, KOMPAS.com – Aksi kekerasan di jalan tol kembali dipertontonkan oleh seorang pengemudi. Jika belum lama ini peristiwa pemukulan pernah terjadi di Gerbang Tol Tomang, Jakarta Barat.
Kini aksi serupa kembali berlangsung di Tol Dalam Kota ruas Gatot Subroto, tepatnya dari Tebet mengarah ke Cawang, Jakarta Selatan.
Dalam video yang diunggah @dashcam_owners_indonesia (4/6/2022), terlihat korban dipukul oleh pelaku di bahu jalan.
Baca juga: Perluasan Ganjil Genap Berlaku 6 Juni, Pelanggar Tak Langsung Ditilang


 
 
 

Lihat postingan ini di Instagram

 
 
 
Sebuah kiriman dibagikan oleh Dash Cam Owners Indonesia (@dashcam_owners_indonesia)


 
Sementara satu orang rekan pelaku yang menggunakan batik, tampak hanya menonton peristiwa itu tanpa berusaha melerai.
Korban sempat melakukan perlawanan, namun usahanya gagal dan terus menjadi amukan pelaku. Pada akhir video, kedua pihak juga sempat melakukan adu mulut.
Belum diketahui penyebab keributan yang berujung aksi pemukulan itu. Namun saat ini kepolisian telah mengamankan pelaku setelah adanya laporan dari korban.
Baca juga: Selain Putih, Juga Ada Pelat Nomor Hijau untuk Kendaraan Khusus

Kabid Humas Polda Metro Jaya Kombes Pol Endra Zulpan mengatakan, pihaknya telah menerima laporan, dengan registrasi nomor: LP/B/2720/VI/2022/SPKT/POLDA METRO JAYA tertanggal 4 Juni 2022.
Meski begitu, sejauh ini Zulpan belum bisa menjelaskan secara rinci kronologi dugaan kasus pemukulan tersebut.
""Iya benar, TKP di ruas Jalan Tol Dalam Kota dekat Gerbang Tol Tebet arah Cawang,"" ujar Zulpan, dikutip dari keterangannya, Sabtu (4/6/2022).
Baca juga: Bahaya Menyalakan Lampu Kabin Saat Berkendara pada Malam Hari 
KOMPAS.com / KRISTIANTO PURNOMO Lalu lintas kendaraan di Tol Dalam Kota Jakarta tampak padat pada jam pulang kerja di hari ketiga pemberlakuan pembatasan sosial berskala besar (PSBB) tahap dua, Rabu (16/9/2020). Pembatasan kendaraan bermotor melalui skema ganjil genap di berbagai ruas Ibu Kota resmi dicabut selama PSBB tahap dua.
""Nama korban Justin Frederick betul. Kasusnya sedang ditangani oleh Ditreskrimum Polda Metro Jaya,"" kata dia. 

",http://otomotif.kompas.com/read/2022/06/05/082100515/viral-pemukulan-di-tol-dalam-kota-ini-pentingnya-defensive-driving
