Judul,Tanggal,Penulis,Label,Kota,Content,Url
"Tergelincir Saat Menikung, 2 Pelajar di Gresik Tewas Tertabrak Truk","Kompas.com - 23/12/2022, 21:58 WIB","Kontributor Gresik, Hamzah Arfah",Regional,GRESIK,"

GRESIK, KOMPAS.com - Dua pelajar tewas usai sepeda motor yang ditumpangi tergelincir dan menabrak truk ketika menikung di Jalan Raya Desa Banyu Urip, Kecamatan Ujungpangkah, Gresik, Jawa Timur, Jumat (23/12/2022).
Kedua pelajar tersebut adalah MKZ (15), warga Desa Tanggulrejo, Kecamatan Manyar, Gresik dan MRA (15), warga Desa Sukorejo, Kecamatan Bungah, Gresik.
Mereka berdua mengendarai sepeda motor Honda Mega Pro dengan nomor polisi S 4186 MM dengan posisi MKZ membonceng MRA.
Baca juga: Terpeleset di Telaga Saat Bermain, Bocah di Gresik Tewas Tenggelam
""Kejadian sekira pukul 13.30 WIB tadi dengan sepeda motor berjalan dari arah barat. Ketika melintas di lokasi yang menikung, pengendara tidak bisa menguasai setir sehingga oleng,"" ujar Kepala Unit Kecelakaan Lalu Lintas Kepolisian Resor (Polres) Gresik Ipda Wiji Mulyono saat dikonfirmasi, Jumat.
Wiji menjelaskan, ketika sepeda motor oleng dan hilang kendali, motor itu lantas menabrak truk boks dengan nomor polisi B 9796 PKS yang dikemudikan oleh Iwan (39), warga Desa Bulurejo, Kecamatan Benjeng, Gresik.
Baca juga: Dikira Meninggal 12 Tahun Lalu, Pria Asal Gresik Pulang ke Rumah Setelah 10 Tahun Dibina di Dinas Sosial Solo
""Sepeda motor mereka kemudian menabrak truk yang saat itu sedang berjalan dari arah sebaliknya,"" ucap Wiji.
Kedua korban sempat dilarikan ke fasilitas kesehatan terdekat, namun luka parah yang dialaminya membuat nyawa kedua pelajar tersebut tidak dapat tertolong.
""Akibat luka berat yang dialami dalam kecelakaan tersebut, akhirnya keduanya meninggal dunia. Keduanya juga sudah dirujuk ke RSUD Ibnu Sina Gresik untuk dilakukan visum,"" tutur Wiji.


Dapatkan update berita pilihan dan breaking news setiap hari dari Kompas.com. Mari bergabung di Grup Telegram ""Kompas.com News Update"", caranya klik link https://t.me/kompascomupdate, kemudian join. Anda harus install aplikasi Telegram terlebih dulu di ponsel.
 ",http://surabaya.kompas.com/read/2022/12/23/215809778/tergelincir-saat-menikung-2-pelajar-di-gresik-tewas-tertabrak-truk
"Banyak Lubang Jalan, Pengguna Keluhkan Sulit Lewati Jalan di Purworejo","Kompas.com - 22/12/2022, 10:14 WIB","Kontributor Purworejo, Bayu Apriliano",Regional,PURWOREJO,"

PURWOREJO, KOMPAS.com- Banyaknya lubang jalan di Kabupaten Purworejo menjadi salah satu faktor tingginya angka kecelakaan.
Salah satunya seperti yang terpantau di sepanjang jalan Purworejo-Magelang dan sejumlah jalan lainnya.  Lubang-lubang jalan ini menyebabkan banyak kendaraan terperosok sehingga menyebabkan laka tunggal maupun laka dengan kendaraan lainnya. 
Baca juga: Protes Jalan Rusak, Warga Kibarkan Bendera Setengah Tiang di Lubang Jalan Jumlah kasus kecelakaan lalu lintas di wilayah hukum Polres Purworejo tahun 2022 pun naik signifikan dibanding tahun sebelumnya. Kanit Gakkum Satlantas Polres Purworejo Iptu Eko Rosdianto mengatakan, berdasarkan data Satlantas Polres Purworejo, jumlah kasus kecelakaan lalu lintas (laka lantas) di tahun 2022 total mencapai 666 kasus.
Jumlah korban meninggal sebanyak 106 orang, kerugian material mencapai Rp 411.800.000.  Selain faktor jalan yang berlubang, kelalaian pengguna jalan menjadi pemicu utama, selebihnya yakni anak-anak di bawah umur yang sudah diizinkan orang tua berkendara di jalan umum.  ""Kecelakaan di Purworejo ada peningkatan dari tahun sebelumnya. Peningkatan ini disebabkan jalan yang berlubang dan faktor dari manusianya sendiri,"" kata Eko pada Kamis (22/12/2022).
Baca juga: Keluarga Usman yang Lumpuh karena Jatuh di Lubang Jalan Cabut Pengaduan ke Polisi  Eko menyebut, di tahun 2021, total jumlah kasus kecelakaan hanya ada 468 kasus dengan korban meninggal dunia sebanyak 96 orang dan kerugian material mencapai Rp 327.100.000.  Ditambahkan, terkait lubang jalan pemicu kecelakaan memang menjadi tengah menjadi fokus perhatian. ",http://yogyakarta.kompas.com/read/2022/12/22/101447178/banyak-lubang-jalan-pengguna-keluhkan-sulit-lewati-jalan-di-purworejo
"Mengaku Korban Kecelakaan, Buronan di Lampung Nekat Buat Laporan Palsu ke Kantor Polisi, Ini Alasannya","Kompas.com - 21/12/2022, 09:12 WIB",Maya Citra Rosa,Regional,KOMPAS.com,"

KOMPAS.com - Seorang buronan kasus penipuan berinisial IP (25) di Lampung membuat laporan palsu mengaku mengalami kecelakaan lalu lintas.
Pelaku nekat membuat laporan palsu lantaran tidak memiliki uang untuk berobat ke rumah sakit setelah kalah berkelahi.
Kepala Satreskrim Polres Pringsewu Inspektur Satu (Iptu) Feabo AM Pranata mengatakan pelaku yang diamankan berinisial IP (25) warga Kecamatan Wonosobo, Kabupaten Tanggamus.
""Pelaku membuat laporan palsu di Mapolres Pringsewu pada hari Minggu sekitar pukul 21.00 WIB,"" kata Feabo dalam keterangan tertulis, Senin (19/12/2022) malam.
IP ditangkap pada Minggu (18/12/2022) di salah satu rumah sakit di Kabupaten Pringsewu.
Pelaku mengaku korban kecelakaan
Baca juga: Kaleidoskop 2022: Heboh Santri Gontor Tewas Dianiaya Senior hingga Wapres Turun Tangan
Feabo mengungkap, pelaku datang melapor ke Mapolrs Pringsewu dalam keadaan babak belur.
""Dia (pelaku) mengaku menjadi korban kecelakaan lalu lintas di wilayah Desa Tarahan, Kecamatan Lampung Selatan,"" kata Feabo.
Pelaku lalu minta tolong kepada anggota yang berjaga untuk diantar berobat ke rumah sakit lantaran dadanya nyeri akibat kecelakaan lalu lintas.
Namun pelaku tidak membawa identitas apapun ketika melapor, dan membuat polisi yang berjaga menjadi curiga dengan tingkahnya yang aneh.
""Tapi tetap kita dampingi memeriksa dan mengobati pelaku di rumah sakit. Sedangkan anggota yang lain melakukan penelusuran atas laporan pelaku,"" kata Feabo. ",http://regional.kompas.com/read/2022/12/21/091246178/mengaku-korban-kecelakaan-buronan-di-lampung-nekat-buat-laporan-palsu-ke
"Motor Tabrak Bengkel di Jombang, Ibu dan 1 Anak Tewas, 2 Lainnya Terluka","Kompas.com - 20/12/2022, 06:53 WIB","Kontributor Jombang, Moh. Syafií",Regional,"JOMBANG, KOMPAS.com","
JOMBANG, KOMPAS.com - Sebanyak dua orang tewas dan dua lainnya terluka akibat kecelakaan di Desa Jogoloyo, Kecamatan Sumobito, Kabupaten Jombang, Jawa Timur, Senin (19/12/2022).
Kecelakaan itu melibatkan seorang ibu dan tiga anaknya. Ibu dan tiga anaknya itu mengendarai sepeda motor di Jalan Raya Desa Jogoloyo.
Baca juga: Viral, Video 2 Siswa SMA di Jombang Dilarikan ke RS Diduga karena Hukuman Fisik, Pihak Sekolah Membantah
Kanit Gakkum Satlantas Polres Jombang Iptu Anang Setiyanto mengungkapkan, seorang ibu dan satu anaknya tewas di lokasi kejadian akibat kecelakaan tersebut.
Sementara dua anak lainnya mengalami luka berat dan ringan. Mereka langsung dilarikan ke rumah sakit usai kejadian.
“Kejadiannya sekitar pukul 10.00 WIB. Korban yang meninggal ada dua orang, ibu sama satu anaknya. Dua anaknya yang lain mengalami luka-luka,” kata Anang saat dikonfirmasi Kompas.com, Senin malam.
Bonceng tiga Anaknya
Anang menuturkan, kecelakaan tersebut berawal saat Andri Budi Ekowati (37), membonceng ketiga anaknya dengan motor matik di jalan raya Desa Jogoloyo, Kecamatan Sumobito.

Dalam perjalanan, setir motor yang dikemudikan Ekowati tiba-tiba oleng ke kiri. Karena laju kendaraan cukup kencang, motor yang dinaiki empat orang itu keluar dari badan jalan kemudian menabrak sebuah bengkel.
“Diduga karena tidak bisa menguasai setir, sehingga kecelakaan itu terjadi. Kendaraan menabrak bangunan bengkel yang ada di utara jalan,” ungkap Anang.
Baca juga: Gara-gara Status WhatsApp, Pelajar di Jombang Dikeroyok hingga Patah Tulang
Akibat kejadian itu, dua orang mengalami luka berat di bagian kepala hingga meninggal dunia di lokasi kecelakaan. Korban tewas adalah Ekowati dan NY (8), salah satu anaknya.
Sedangkan dua anak dari Ekowati, IF (16) dan YNA (2), dilarikan ke rumah sakit. IF mengalami luka berat, sedangkan YNA mengalami luka ringan.
Dapatkan update berita pilihan dan breaking news setiap hari dari Kompas.com. Mari bergabung di Grup Telegram ""Kompas.com News Update"", caranya klik link https://t.me/kompascomupdate, kemudian join. Anda harus install aplikasi Telegram terlebih dulu di ponsel.
 ",http://surabaya.kompas.com/read/2022/12/20/065333878/motor-tabrak-bengkel-di-jombang-ibu-dan-1-anak-tewas-2-lainnya-terluka
"Bus Pariwisata Hilang Kendali, Tabrak Pejalan Kaki hingga Rumah di Tanah Datar","Kompas.com - 15/12/2022, 15:42 WIB","Kontributor Padang, Perdana Putra",Regional,"PADANG, KOMPAS.com","
PADANG, KOMPAS.com-Diduga hilang kendali, bus pariwisata tabrak rumah warga, pejalan kaki hingga sepeda motor yang diparkir.
Peristiwa terjadi di Jalan Raya Padang Panjang-Bukittinggi, Nagari Koto Baru, Kecamatan X Koto, Kabupaten Tanah Datar, Sumatra Barat, Kamis (15/12/2022).
""Kejadian sekitar pukul 09.00 WIB. Bus diduga hilang kendali dan menabrak rumah, pejalan kaki hingga sepeda motor,"" kata Kasat Lantas Polres Padang Panjang Iptu Aldy Lazzuardy yang dihubungi Kompas.com, Kamis.
Baca juga: 7 Orang Tewas Usai Bus Pariwisata Terjun ke Jurang di Jalur Sarangan-Tawangmangu
Aldy mengatakan peristiwa berawal dari bus Mercedes Benz dengan nomor polisi BA 7030 LA datang dari arah Bukittinggi menuju arah Padang Panjang.
Sesampai di tempat kejadian, diduga bola-bola setir bus putus sehingga bus hilang kendali.
“Bus menabrak bibir parit dan juga tiga unit rumah warga serta tiga unit motor yang terparkir,” kata Aldy.
Baca juga: Bus Tabrak Motor di Pekanbaru, 1 Korban Tewas, Sopir Kabur
Beruntung dalam kejadian itu tidak ada korban jiwa.
""Untuk tiga pejalan kaki yang ditabrak mengalami luka-luka ringan dan kemudian dibawa ke rumah sakit,"" kata Aldy.
Dapatkan update berita pilihan dan breaking news setiap hari dari Kompas.com. Mari bergabung di Grup Telegram ""Kompas.com News Update"", caranya klik link https://t.me/kompascomupdate, kemudian join. Anda harus install aplikasi Telegram terlebih dulu di ponsel.
 ",http://regional.kompas.com/read/2022/12/15/154224378/bus-pariwisata-hilang-kendali-tabrak-pejalan-kaki-hingga-rumah-di-tanah
Pengendara Honda Vario di Semarang Tewas Setelah Disundul Truk,"Kompas.com - 15/12/2022, 14:10 WIB","Kontributor Semarang, Muchamad Dafi Yusuf",Regional,"SEMARANG, KOMPAS.com","
SEMARANG, KOMPAS.com - Seorang pengendara ditemukan tewas setelah menabrak bokong truk di traffic light depan Terminal Mangkang, Kota Semarang, Jawa Tengah (Jateng).
Salah satu saksi, Rio Sadewo mengatakan, pengendara sepeda motor merek Honda Vario itu langsung tewas di lokasi setelah menabrak truk.
Baca juga: Aksi Ibu-ibu Asal Kupang Tarik Truk yang Terperosok di Jembatan Pakai Tambang
""Katanya dia pegawai Indomaret,"" jelasnya saat dikonfirmasi, Kamis (15/12/2022).
Dia menjelaskan, awalnya pengendara sepeda motor tersebut berniat menghindari truk yang ada di depannya namun gagal menghindari.
""Setelah gagal menghindari sepeda motor korban nyenggol bokong truk,"" paparnya.
Setelah nyenggol bokong truk yang ada di depannya, korban kemudian jatuh dan disundul oleh truk kedua kalinya yang datang dari arah belakang.
""Setelah jatuh langsung disundul truk lagi,"" ujarnya.
Saat dikonfirmasi, Kanit Lakalantas, Satlantas Polrestabes Semarang AKP Adji Setiawan menyampaikan, anggotanya sedang menuju tempat kejadian perkara (TKP) untuk dilakukan olah TKP.
""Ini anggota sedang ke TKP. Nanti hasilnya saya share ke pesan WhatsApp, "" tuturnya.
Baca juga: Kecelakaan Kembali Terjadi di Tanjakan Kalimalang Ungaran, Truk Masuk Jurang, Kontainer Terlepas dari Sasis
Dapatkan update berita pilihan dan breaking news setiap hari dari Kompas.com. Mari bergabung di Grup Telegram ""Kompas.com News Update"", caranya klik link https://t.me/kompascomupdate, kemudian join. Anda harus install aplikasi Telegram terlebih dulu di ponsel.
 ",http://regional.kompas.com/read/2022/12/15/141039278/pengendara-honda-vario-di-semarang-tewas-setelah-disundul-truk
"Kecelakaan Lalu Lintas Berujung Amuk Massa di Dogiyai, Ratusan Bangunan Dibakar, Warga Mengungsi","Kompas.com - 15/12/2022, 07:28 WIB","Kontributor Jayapura, Dhias Suwandi",Regional,"JAYAPURA, KOMPAS.com","
JAYAPURA, KOMPAS.com - Situasi keamanan dan ketertiban masyarakat di Kabupaten Dogiyai, Papua Tengah, cukup kondusif, selama 2022.
Namun, tercatat sempat terjadi dua kali amuk massa yang sama-sama dipicu oleh kejadian kecelakaan lalu lintas.
Sabtu (12/11/2022) siang, di Mauwaba Ikebo, Distrik Monamani, sebuah truk menabrak seorang anak Noldy Goo (5). Korban tewas di lokasi kejadian.
Warga dan keluarga korban yang melihat kejadian, langsung menyerang sopir truk tersebut. Aparat keamanan langsung mengamankan sopir yang menabrak bocah itu dan membawanya ke Polres Dogiyai.
Baca juga: Diduga Jadi Dalang Amuk Massa, Ketua KNPB Dogiyai Ditangkap Polisi
Namun, massa yang marah justru mendatangi Polres Dogiyai. Mereka mendesak polisi menyerahkan sopir truk tersebut.
""Dampak dari kejadian tersebut, sekelompok massa merangksek maju ke Polres dan berusaha mengambil sopir, namun berhasil diarahkan dan dikendalikan,"" kata Direksrimum Polda Papua Kombes Faizal Ramadhani di Jayapura, Sabtu (12/11/2022).
Setelah itu, massa dari Kampung Mauwa dan Kamu Selatan, bergabung dengan massa tersebut.
""Massa bergabung dari arah Kampung Mauwa dan Kamu Selatan memaksa masuk untuk membakar Pasar Ikebo, namun sementara berhasil dihalau dengan tembakan gas air mata dan pasukan gabungan ambil posisi bertahan jaga dalam kota,"" kata Faizal.
Massa lalu melampiaskan kemarahannya dengan membakar bangunan dan menyerang warga lain yang lewat. Akibatnya, seorang warga bernama Iqbal tewas dianiaya massa dan ditemukan dalam kondisi terkubur.
Selain itu, terdapat dua polisi yang terluka akibat terkena panah.

Bangunan dibakar, ratusan warga mengungsi
Kerugian materiel akibat kejadian itu cukup besar karena massa merusak dan membakar apa pun yang mereka lewati.
""Sebanyak 27 unit rumah tinggal, 51 unit kios, sembilan unit rumah kos, sembilan unit ruko, 11 unit truk, 20 unit sepeda motor, satu unit ekskavator, dan enam unit bangunan pemerintahan,” kata Faizal.
Dampak lain, sekitar 400 warga yang tinggal di Distrik Kamu memilih mengungsi ke Kabupaten Nabire.
 ",http://regional.kompas.com/read/2022/12/15/072802078/kecelakaan-lalu-lintas-berujung-amuk-massa-di-dogiyai-ratusan-bangunan
"Pedagang Gorengan Kena Minyak Panas Usai Ditabrak Motor, Tangan dan Kakinya Melepuh","Kompas.com - 14/12/2022, 21:25 WIB",Annisa Ramadani Siregar,Megapolitan,"TANGERANG SELATAN, KOMPAS.com","
TANGERANG SELATAN, KOMPAS.com - Sunan (40), pedagang gorengan yang ditabrak lari pengendara motor Honda Scoopy, mengalami luka akibat terkena minyak panas. Tangan kanan dan kaki kirinya melepuh.
Adapun kecelakaan itu terjadi di Taman Menteng Bintaro Sektor 7, Tangerang Selatan, Banten, pada Minggu (11/12/2022) sekitar pukul 06.00 WIB.
Setelah ditabrak, Sunan memilih untuk pulang ke kampung halamannya di Sumedang, Jawa Barat.
""Untung masih ada kemarin uang buat ongkos pulang. Habis maghrib langsung balik saya, kan di rumah (kontrakan) sendirian, walau tetangga pada baik kasih makan, tapi saya mau pulang saja,"" ujar Sunan saat dihubungi, Rabu (14/12/2022).
Baca juga: Ditabrak Pengendara Motor di Tangsel, Pedagang Gorengan Terluka Kena Minyak Panas
Karena tubuhnya yang terluka, Sunan tidak bisa beraktivitas seperti biasanya. Ia pun lebih memilih untuk menemui istri dan dua anaknya di Sumedang.
Saat ini, luka pada tangan dan kaki Sunan sudah mulai mengering. Akan tetapi, untuk sementara luka tersebut harus ditutup dengan perban.
""Sekarang tangannya mulai nyut-nyutan, mau mengering kali lukanya. Sudah melepuh ini tangan dan kaki (sakit),"" jelas Sunan.
""Kata dokter disuruh ganti perban, saya ganti ke puskesmas terus kontrol. Masih ada obat dari klinik. Kalau (obat) sudah habis, baru ke dokter lagi, kontrol,"" lanjut dia.
Baca juga: Cerita Pedagang Gorengan Terluka Kena Minyak Panas usai Ditabrak Lari Sepeda Motor
Sementara itu, Kanit Laka Lantas Polres Tangsel Iptu Nanda Setya mengatakan bahwa pihaknya sudah mengecek ke lokasi.
Polisi juga sudah mendatangi kediaman Sunan, tetapi pedagang itu sudah pulang kampung. ",http://megapolitan.kompas.com/read/2022/12/14/21252011/pedagang-gorengan-kena-minyak-panas-usai-ditabrak-motor-tangan-dan
"Diduga Tergelincir, Pengendara Motor Tewas Saat Mendahului Truk","Kompas.com - 14/12/2022, 07:11 WIB","Kontributor Pematangsiantar, Teguh Pribadi",Regional,"PEMATANG SIANTAR, KOMPAS.com -","

PEMATANG SIANTAR, KOMPAS.com - Kecelakaan lalu lintas melibatkan truk BK 8815 CO dan sepeda motor BK 2483 WAJ terjadi di Jalan Medan, Kelurahan Medan, Kecamatan Siantar Martoba, Selasa (13/12/2022).. Akibat peristiwa ini, pengemudi sepeda motor tewas.
Kepala unit Lakalantas Polres Pematang Siantar, Iptu Syawal Nasution mengatakan, korban diketahui bernama YM (23) Warga Jalan Melati, Kelurahan Tambun Nabolon, Siantar Martoba.
Sebelum kejadian, korban mengendarai sepeda motor dari arah Kota Medan menuju pusat kota Pematang Siantar. Sementara dari arah yang sama, melaju truk Hino yang dikemudikan oleh Sopir inisial AM (39).
Baca juga: Dalam Sehari, Terjadi Dua Kecelakaan yang Melibatkan Kereta Wisata di Kabupaten Semarang
""Namun sesampainya di TKP korban diduga mendahului truk, sehingga kita menduga kalau sepeda motornya tergelincir dan korban masuk kedalam kolong truk,"" kata Syawal kepada Wartawan.
Sementara itu, sopir truk AM mengaku sama sekali tidak melihat sepeda motor berada di posisi kiri atau kanan truk tersebut.
Saat kejadian, AM menyetir truk pengangkut besi menuju Porsea Kabupaten Toba dan sudah melaju sesuai jalur.
""Tiba-tiba ada orang teriak, ‘Bang meninggal,’ di situ aku langsung berhenti karena sempat bingung kan, apa yang meninggal. Begitu aku turun aku lihat sudah ada mayat dibawah bangku,"" ujar warga Porsea ini.
Akibat peristiwa itu korban tewas di lokasi kejadian. Polisi mengamankan sepeda motor dan truk serta melakukan olah TKP.
Polisi juga mengevakuasi korban ke ruang instalasi jenazah RSUD Djasamen Saragih di Jalan Vihara Kota Pematang Siantar.
Baca juga: Motor Tabrak Trotoar di Jalan Jenderal Sudirman Ambon, Pengendara Tewas
Di ruang instalasi jenazah, jerit tangis Ibu korban pecah menyaksikan korban terbujur kaku. Rekan rekan korban tampak berupaya menenangkan.
Salah seorang rekan kerja korban yang datang ke lokasi, tak menyangka peristiwa kecelakaan itu merenggut nyawa YM.
""Kami satu kantor gak ada yang menyangka kalau dia meninggal. Padahal dia itu tadi mau berangkat kerja,"" ungkapnya.
Dapatkan update berita pilihan dan breaking news setiap hari dari Kompas.com. Mari bergabung di Grup Telegram ""Kompas.com News Update"", caranya klik link https://t.me/kompascomupdate, kemudian join. Anda harus install aplikasi Telegram terlebih dulu di ponsel.
 ",http://medan.kompas.com/read/2022/12/14/071131778/diduga-tergelincir-pengendara-motor-tewas-saat-mendahului-truk
"Tertabrak Truk Saat Menyeberang, Bocah Berusia 3 Tahun di Banyuwangi Selamat","Kompas.com - 14/12/2022, 05:13 WIB","Kontributor Banyuwangi, Rizki Alfian Restiawan",Regional,"BANYUWANGI, KOMPAS.com","
BANYUWANGI, KOMPAS.com - Devan Alano Fadilah, bocah asal Dusun Sumberbening, Desa Kesilir, Kecamatan Siliragung, Banyuwangi, selamat dari kecelakaan maut.
Bocah berusia tiga tahun itu tertabrak dan terlindas ban bagian depan truk molen dengan nomor polisi B 9899 UIN, saat berusaha menyebrang jalan.
Baca juga: Gempa Bumi Magnitudo 5,2 Bali Dirasakan Warga Banyuwangi
Korban mengalami kecelakaan di jalan raya Siliragung jurusan Pesanggaran, Dusun Sumberbening, Desa kesilir, tepat di simpang empat fitnes utara Perhutani Siliragung.
""Kejadiannya Senin petang kemarin,"" kata Kanit Lantas Polsek Gambiran Aiptu Muhammad Basori, Selasa (13/12/2022).

Kecelakaan itu bermula ketika truk yang dikendarai S, warga Desa Sengguguh, Kecamatan Kepanjen, Malang, melajut dari arah selatan ke utara.
Tiba di lokasi, korban hendak menyeberang jalan. Karena jarak yang terlalu dekat, korban tertabrak truk.
""Akibat kejadian itu korban mengalami luka terbuka di kaki kanan dan luka terbuka pada kemaluan,"" ungkap Basori.
Baca juga: Dinas Kesehatan Banyuwangi Ambil Sampel Makanan Diduga Penyebab Keracunan Massal
Korban langsung dilarikan ke Rumah Sakit Al Huda Gambiran, Banyuwangi, untuk mendapatkan perawatan medis.
""Sementara sopir dan truk molen diamankan ke Pos Lantas Polsek Gambiran,"" pungkas Basori.
Dapatkan update berita pilihan dan breaking news setiap hari dari Kompas.com. Mari bergabung di Grup Telegram ""Kompas.com News Update"", caranya klik link https://t.me/kompascomupdate, kemudian join. Anda harus install aplikasi Telegram terlebih dulu di ponsel.
 ",http://surabaya.kompas.com/read/2022/12/14/051300278/tertabrak-truk-saat-menyeberang-bocah-berusia-3-tahun-di-banyuwangi-selamat
"Motor Tabrak Trotoar di Jalan Jenderal Sudirman Ambon, Pengendara Tewas","Kompas.com - 13/12/2022, 23:48 WIB","Kontributor Ambon, Rahmat Rahman Patty",Regional,"AMBON, KOMPAS.com","
AMBON, KOMPAS.com - Sebuah motor yang melaju kencang mengalami kecelakaan di Jalan Jenderal sudirman, Kota Ambon, Selasa (13/12/2022) dini hari.
Kecelakaan itu terjadi setelah pengendara motor Josua Watimena (19), tak mampu mengendalikan laju kendaraannya. Josua lalu menabrak trotoar di lokasi kecelakaan.
Baca juga: Cerita Korban Kebakaran di Ambon Menyelamatkan Diri, Hanya Bawa Pakaian di Badan
Akibat kejadian itu pengendara motor dinyatakan meninggal dunia, sedangkan penumpang motor itu menderita luka parah.
Kepala Seksi Humas Polresta Pulau Ambon Ipda Moyo Utomo mengatakan, kecelakaan tersebut bermula saat korban memacu sepeda motor Yamaha Jupiter Z dengan kecepatan tinggi dari arah pusat kota menuju Desa Poka, Kecamatan Teluk Ambon.
Tiba di lokasi kejadian, korban tidak bisa mengendalikan laju kendaraannya dan akhirnya menabrak trotoar di kawasan tersebut. Akibatnya, korban terhempas dari motor dan terseret di jalan.
“Korban melaju dengan kecepatan tinggi dan tak bisa megendalikan kendaraanya kemudian  menabrak trotoar,” kata Moyo di Ambon, Selasa (13/12/2022).
Moyo menambahkan, polisi yang mengetahui kejadian itu langsung mendatangi lokasi kecelakaan untuk melakukan olah tempat kejadian perkara.
Selanjutnya kedua korban yang tergeletak dengan tubuh penuh luka langsung dilarikan ke Rumah Sakit Bhayangkara Ambon untuk menjalani perawatan medis.
Baca juga: Tanggapi Keluhan Warga, BPBD Ambon Mulai Bangun MCK di Lokasi Pengungsian Kebakaran
Namu, tim medis menyatakan pengendara motor itu tak bisa diselamatkan.
“Pengendara meninggal dunia setelah sempat dirawat di rumah sakit sedangkan boncengannya sampai saat ini masih menjalani perawatan intensif,” ujarnya.
Dapatkan update berita pilihan dan breaking news setiap hari dari Kompas.com. Mari bergabung di Grup Telegram ""Kompas.com News Update"", caranya klik link https://t.me/kompascomupdate, kemudian join. Anda harus install aplikasi Telegram terlebih dulu di ponsel.
 ",http://regional.kompas.com/read/2022/12/13/234830178/motor-tabrak-trotoar-di-jalan-jenderal-sudirman-ambon-pengendara-tewas
"Banyak Fungsi Penting, Tren Pasang Dashcam Meningkat","Kompas.com - 13/12/2022, 17:21 WIB",Donny Dwisatryo Priyantoro,Aksesoris,"JAKARTA, KOMPAS.com","

JAKARTA, KOMPAS.com - Salah satu perangkat yang belakangan ini banyak digunakan di mobil adalah kamera dasbor atau dashboard camera (dashcam). Sebab, perangkat ini punya banyak fungsi penting.
Dengan menggunakan dashcam, pengguna mobil bisa merekam kejadian, baik kasus kecelakaan lalu lintas atau tindak pidana. Sehingga, bisa memudahkan dalam proses penyelesaian masalah.
Baca juga: Dashcam Jadi Alat Bukti Modus Kecelakaan Berujung Pemerasan 
Herman Budiman, pemilik workshop Automania, mengatakan, sekarang sedang tren memasang Digital Video Recorder (DVR), karena sekaligus sebagai alat bukti jika terjadi sesuatu yang tidak diinginkan di jalan,"" ujar Herman, saat dihubungi Kompas.com, Selasa (13/12/2022).
Dok. Unsplash.com Ilustrasi kamera dasbor atau dashboard camera (dashcam)
Herman mengatakan, per bulannya dia bisa menjual hingga tiga set hingga lima set. Sedangkan untuk kisaran harga dashcam sendiri, bisa mencapai Rp 1,8 jutaan.
Dashcam yang dijual pada umumnya bersifat universal. Sehingga, bisa dipasang pada semua mobil, baik yang modern maupun lawas sekalipun.
Baca juga: Banyak Aksi Brutal di Jalan, Pentingnya Dashcam Jadi Alat Bukti
Menurutnya, setiap mobil memiliki tingkat kesulitan yang berbeda dalam pemasangan dashcam. Perbedaan harga bisa berdasarkan tingkat kesulitan pemasangannya.
Dok. Blackvue Blackvue DR750X-3CH Plus, pilihan kamera dasbor di IIMS 2022
""Contohnya, di mobil-mobil premium pasti harga instalasinya lebih mahal dibanding mobil umum,"" kata Hendra, yang memasarkan merek Mtech.
Selain itu, ada juga dashcam dengan merek Blackvue, yang banderolnya cukup tinggi. Harganya berkisar mulai Rp 2 jutaan hingga Rp 11 jutaan.
Dashcam Blackvue Salah satu produk yang bisa digunakan untuk merekam kejadian di jalan, yakni Dashcam Blackvue
Rudy Ham, Direktur Pemasaran Dashcam Blackvue, mengatakan, Blackvue bekerja layaknya blackbox di dalam mobil. Sehingga, tidak ada rasa khawatir lagi bahwa kita akan kehilangan bukti ketika terjadi sesuatu di jalanan.
“Dengan menggunakan dashcam yang sudah terpercaya tentu memberikan kita rasa tenang ketika kita berkendara”, kata Rudy, dalam kesempatan yang berbeda.
Dapatkan update berita pilihan dan breaking news setiap hari dari Kompas.com. Mari bergabung di Grup Telegram ""Kompas.com News Update"", caranya klik link https://t.me/kompascomupdate, kemudian join. Anda harus install aplikasi Telegram terlebih dulu di ponsel.
 

",http://otomotif.kompas.com/read/2022/12/13/172100915/banyak-fungsi-penting-tren-pasang-dashcam-meningkat
